{
  "report_version": 1,
  "generated_at": "2026-10-29T12:24:38.539400167Z",
  "doriki_version": "dev",
  "manifest": {
    "manifest_version": 1,
    "pod": {
      "namespace": "doriki",
      "name": "llamacpp-6f8fbbc7b4-ldmpw",
      "uid": "0793ab98-318d-4cb1-aba5-74d0a0e07706",
      "owner": "Deployment/llamacpp",
      "owner_ref": "ReplicaSet/llamacpp-6f8fbbc7b4"
    },
    "node": {
      "name": "doriki-control-plane",
      "kubelet": "v1.37.0"
    },
    "container": {
      "image": "ghcr.io/ggml-org/llama.cpp:server@sha256:5741ab30aae42af23ca57d9b98a6d4544cb09c21f372f92c5ee55312fa8b8b0c",
      "image_digest": "sha256:5741ab30aae42af23ca57d9b98a6d4544cb09c21f372f92c5ee55312fa8b8b0c",
      "args": [
        "--hf-repo",
        "ggml-org/models",
        "--hf-file",
        "tinyllamas/stories15M-q4_0.gguf",
        "--host",
        "0.0.0.0",
        "--port",
        "8080",
        "-lv",
        "4"
      ],
      "env_allowlist": {
        "LLAMA_CACHE": "/cache"
      }
    },
    "engine": {
      "name": "llamacpp",
      "version": "11889",
      "parser_pack": "llamacpp/11889"
    },
    "model": {
      "ref": "ggml-org/models",
      "source": "huggingface.co"
    },
    "fingerprint": "sha256:02fc85a53c71ecc0ca749dd397824458f2cbea3aeac93ca1056087ce50f32cbf"
  },
  "attempt": 0,
  "attempts_total": 1,
  "phases": [
    {
      "name": "scheduling",
      "start": "2026-10-29T12:19:47Z",
      "end": "2026-10-29T12:19:47Z",
      "seconds": 0,
      "state": "complete",
      "sources": [
        "k8s-event",
        "container-status"
      ]
    },
    {
      "name": "node-provision",
      "state": "absent"
    },
    {
      "name": "image-pull",
      "start": "2026-10-29T12:19:48Z",
      "end": "2026-10-29T12:24:23Z",
      "seconds": 275,
      "state": "complete",
      "sources": [
        "k8s-event"
      ]
    },
    {
      "name": "container-init",
      "start": "2026-10-29T12:24:23Z",
      "end": "2026-10-29T12:24:24.029056588Z",
      "seconds": 1.029056588,
      "state": "complete",
      "sources": [
        "container-status",
        "engine-log"
      ]
    },
    {
      "name": "engine-init",
      "start": "2026-10-29T12:24:24.029056588Z",
      "end": "2026-10-29T12:24:25.351323574Z",
      "seconds": 1.322266986,
      "state": "complete",
      "sources": [
        "engine-log"
      ]
    },
    {
      "name": "weight-fetch",
      "start": "2026-10-29T12:24:25.351323574Z",
      "end": "2026-10-29T12:24:35.841571479Z",
      "seconds": 10.490247905,
      "state": "complete",
      "attrs": {
        "model": "ggml-org/models"
      },
      "sources": [
        "engine-log"
      ],
      "confidence": 0.8
    },
    {
      "name": "weight-load",
      "start": "2026-10-29T12:24:35.841571479Z",
      "end": "2026-10-29T12:24:35.946615428Z",
      "seconds": 0.105043949,
      "state": "complete",
      "attrs": {
        "model": "ggml-org/models"
      },
      "sources": [
        "engine-log"
      ]
    },
    {
      "name": "compile",
      "state": "skipped",
      "attrs": {
        "not_applicable": "true"
      }
    },
    {
      "name": "graph-capture",
      "state": "skipped",
      "attrs": {
        "not_applicable": "true"
      }
    },
    {
      "name": "kv-alloc",
      "start": "2026-10-29T12:24:35.946615428Z",
      "end": "2026-10-29T12:24:35.94666918Z",
      "seconds": 0.000053752,
      "state": "complete",
      "attrs": {
        "mib": "1.69"
      },
      "sources": [
        "engine-log"
      ]
    },
    {
      "name": "server-ready",
      "start": "2026-10-29T12:24:36.103726106Z",
      "end": "2026-10-29T12:24:37Z",
      "seconds": 0.896273894,
      "state": "complete",
      "sources": [
        "container-status",
        "engine-log"
      ]
    },
    {
      "name": "first-token",
      "state": "absent"
    }
  ],
  "totals": {
    "pending_to_ready_seconds": 290
  },
  "advice": [
    {
      "rule": "pull-dominant",
      "severity": "high",
      "text": "image-pull took 95% of startup (275 s of 290 s) and the image was not on the node; move the model weights into an image volume, prepull the image with a DaemonSet, or pull lazily with SOCI or estargz.",
      "evidence": {
        "kubelet": "v1.37.0",
        "seconds": 275,
        "share": 0.9482758620689655,
        "total_seconds": 290
      },
      "fix": "an image volume (spec.volumes[].image) for the model weights; a prepull DaemonSet for the image; lazy pulling with the SOCI or estargz snapshotter"
    }
  ]
}
