{
  "report_version": 1,
  "generated_at": "2026-10-24T15:00:00Z",
  "doriki_version": "dev",
  "manifest": {
    "manifest_version": 1,
    "pod": {
      "namespace": "default",
      "name": "nginx-89d46f4b4-ndl9f"
    },
    "node": {
      "name": "doriki-control-plane"
    },
    "engine": {
      "parser_pack": "generic"
    }
  },
  "attempt": 0,
  "attempts_total": 1,
  "phases": [
    {
      "name": "scheduling",
      "start": "2026-10-25T09:15:05Z",
      "end": "2026-10-25T09:15:05Z",
      "seconds": 0,
      "state": "complete",
      "sources": [
        "k8s-event",
        "container-status"
      ]
    },
    {
      "name": "node-provision",
      "state": "absent"
    },
    {
      "name": "image-pull",
      "start": "2026-10-25T09:15:06Z",
      "end": "2026-10-25T09:15:06Z",
      "seconds": 0,
      "state": "complete",
      "attrs": {
        "cached": "true"
      },
      "sources": [
        "k8s-event"
      ]
    },
    {
      "name": "container-init",
      "start": "2026-10-25T09:15:06Z",
      "end": "2026-10-25T09:15:06.556135118Z",
      "seconds": 0.556135118,
      "state": "complete",
      "sources": [
        "container-status",
        "engine-log"
      ]
    },
    {
      "name": "engine-init",
      "state": "absent"
    },
    {
      "name": "weight-fetch",
      "state": "absent"
    },
    {
      "name": "weight-load",
      "state": "absent"
    },
    {
      "name": "compile",
      "state": "absent"
    },
    {
      "name": "graph-capture",
      "state": "absent"
    },
    {
      "name": "kv-alloc",
      "state": "absent"
    },
    {
      "name": "server-ready",
      "state": "absent"
    },
    {
      "name": "first-token",
      "state": "absent"
    }
  ],
  "totals": {
    "pending_to_ready_seconds": 2
  },
  "warnings": [
    {
      "code": "no-pack",
      "text": "no parser pack matches image \"nginx:1.29.3-alpine\"; only Kubernetes phases are reported"
    }
  ]
}
