{
  "report_version": 1,
  "generated_at": "2026-10-24T15:00:00Z",
  "doriki_version": "dev",
  "manifest": {
    "manifest_version": 1,
    "pod": {
      "namespace": "doriki",
      "name": "llamacpp-f6ff5f6c9-tl55v",
      "uid": "ed32257c-f268-4c5e-87c6-13deba17b6e0",
      "owner": "Deployment/llamacpp",
      "owner_ref": "ReplicaSet/llamacpp-f6ff5f6c9"
    },
    "node": {
      "name": "doriki-control-plane"
    },
    "container": {
      "image": "ghcr.io/ggml-org/llama.cpp:server@sha256:5741ab30aae42af23ca57d9b98a6d4544cb09c21f372f92c5ee55312fa8b8b0c",
      "image_digest": "sha256:5741ab30aae42af23ca57d9b98a6d4544cb09c21f372f92c5ee55312fa8b8b0c",
      "args": [
        "--hf-repo",
        "ggml-org/models",
        "--hf-file",
        "tinyllamas/stories15M-q4_0.gguf",
        "--host",
        "0.0.0.0",
        "--port",
        "8080"
      ],
      "env_allowlist": {
        "LLAMA_CACHE": "/cache"
      }
    },
    "engine": {
      "name": "llamacpp",
      "parser_pack": "llamacpp/11889"
    },
    "model": {
      "ref": "ggml-org/models",
      "source": "huggingface.co"
    },
    "fingerprint": "sha256:af4a4711600a1420ed66df483f84b3f8d03d8c1cba1d38b36bbac1a2657d4585"
  },
  "attempt": 0,
  "attempts_total": 1,
  "phases": [
    {
      "name": "scheduling",
      "start": "2026-10-26T13:18:20Z",
      "end": "2026-10-26T13:18:20Z",
      "seconds": 0,
      "state": "complete",
      "sources": [
        "k8s-event",
        "container-status"
      ]
    },
    {
      "name": "node-provision",
      "state": "absent"
    },
    {
      "name": "image-pull",
      "start": "2026-10-26T13:18:21Z",
      "end": "2026-10-26T13:21:09Z",
      "seconds": 168,
      "state": "complete",
      "sources": [
        "k8s-event"
      ]
    },
    {
      "name": "container-init",
      "start": "2026-10-26T13:21:10Z",
      "end": "2026-10-26T13:21:10.309482346Z",
      "seconds": 0.309482346,
      "state": "complete",
      "sources": [
        "container-status",
        "engine-log"
      ]
    },
    {
      "name": "engine-init",
      "start": "2026-10-26T13:21:10.309482346Z",
      "end": "2026-10-26T13:21:11.878264684Z",
      "seconds": 1.568782338,
      "state": "complete",
      "sources": [
        "engine-log"
      ]
    },
    {
      "name": "weight-fetch",
      "start": "2026-10-26T13:21:11.878264684Z",
      "end": "2026-10-26T13:21:22.744553822Z",
      "seconds": 10.866289137999999,
      "state": "complete",
      "attrs": {
        "model": "ggml-org/models"
      },
      "sources": [
        "engine-log"
      ],
      "confidence": 0.8
    },
    {
      "name": "weight-load",
      "start": "2026-10-26T13:21:22.744553822Z",
      "end": "2026-10-26T13:21:22.861609284Z",
      "seconds": 0.117055462,
      "state": "complete",
      "attrs": {
        "model": "ggml-org/models"
      },
      "sources": [
        "engine-log"
      ]
    },
    {
      "name": "compile",
      "state": "skipped",
      "attrs": {
        "not_applicable": "true"
      }
    },
    {
      "name": "graph-capture",
      "state": "skipped",
      "attrs": {
        "not_applicable": "true"
      }
    },
    {
      "name": "kv-alloc",
      "state": "absent"
    },
    {
      "name": "server-ready",
      "start": "2026-10-26T13:21:22.861683792Z",
      "end": "2026-10-26T13:21:24Z",
      "seconds": 1.138316208,
      "state": "complete",
      "sources": [
        "container-status",
        "engine-log"
      ]
    },
    {
      "name": "first-token",
      "state": "absent"
    }
  ],
  "totals": {
    "pending_to_ready_seconds": 184
  },
  "advice": [
    {
      "rule": "pull-dominant",
      "severity": "high",
      "text": "image-pull took 91% of startup (168 s of 184 s) and the image was not on the node; prepull it with a DaemonSet or pull lazily with SOCI or estargz (image volumes are not suggested: the node's kubelet version could not be read).",
      "evidence": {
        "kubelet": "unknown",
        "seconds": 168,
        "share": 0.9130434782608695,
        "total_seconds": 184
      },
      "fix": "a prepull DaemonSet for the image; lazy pulling with the SOCI or estargz snapshotter"
    }
  ],
  "warnings": [
    {
      "code": "pack-version-unknown",
      "text": "the log does not say the engine version in its first 200 lines; using pack llamacpp/11889, tested with 11889; llama.cpp prints its build only at -lv 4 or above"
    }
  ]
}
