{
  "report_version": 1,
  "generated_at": "2026-10-24T15:00:00Z",
  "doriki_version": "dev",
  "manifest": {
    "manifest_version": 1,
    "pod": {
      "namespace": "default",
      "name": "vllm-785fb8997d-bvsz4"
    },
    "node": {
      "name": "doriki-control-plane"
    },
    "engine": {
      "name": "vllm",
      "version": "0.32.0",
      "parser_pack": "vllm/0.32"
    },
    "model": {
      "ref": "facebook/opt-125m"
    }
  },
  "attempt": 0,
  "attempts_total": 1,
  "phases": [
    {
      "name": "scheduling",
      "start": "2026-10-25T09:23:40Z",
      "end": "2026-10-25T09:23:40Z",
      "seconds": 0,
      "state": "complete",
      "sources": [
        "k8s-event",
        "container-status"
      ]
    },
    {
      "name": "node-provision",
      "state": "absent"
    },
    {
      "name": "image-pull",
      "start": "2026-10-25T09:23:41Z",
      "end": "2026-10-25T09:28:09Z",
      "seconds": 268,
      "state": "complete",
      "sources": [
        "k8s-event"
      ]
    },
    {
      "name": "container-init",
      "start": "2026-10-25T09:28:09Z",
      "end": "2026-10-25T09:28:09.367014427Z",
      "seconds": 0.367014427,
      "state": "complete",
      "sources": [
        "container-status",
        "engine-log"
      ]
    },
    {
      "name": "engine-init",
      "start": "2026-10-25T09:28:09.367014427Z",
      "end": "2026-10-25T09:29:19.952989112Z",
      "seconds": 70.585974685,
      "state": "complete",
      "attrs": {
        "model": "facebook/opt-125m"
      },
      "sources": [
        "engine-log"
      ]
    },
    {
      "name": "weight-fetch",
      "start": "2026-10-25T09:29:21.427176435Z",
      "end": "2026-10-25T09:31:09.613199435Z",
      "seconds": 108.186023,
      "state": "complete",
      "attrs": {
        "model": "facebook/opt-125m",
        "seconds": "108.186023",
        "start_derived": "end minus 108.186023 s reported by the engine"
      },
      "sources": [
        "engine-log"
      ],
      "confidence": 0.9
    },
    {
      "name": "weight-load",
      "start": "2026-10-25T09:31:09.613559029Z",
      "end": "2026-10-25T09:31:10.103559029Z",
      "seconds": 0.49,
      "state": "complete",
      "attrs": {
        "seconds": "0.49",
        "start_derived": "end minus 0.49 s reported by the engine"
      },
      "sources": [
        "engine-log"
      ],
      "confidence": 0.9
    },
    {
      "name": "compile",
      "state": "skipped",
      "attrs": {
        "skipped_by": "vllm.compile.skipped"
      },
      "sources": [
        "engine-log"
      ]
    },
    {
      "name": "graph-capture",
      "state": "skipped",
      "attrs": {
        "skipped_by": "vllm.graph.skipped"
      },
      "sources": [
        "engine-log"
      ]
    },
    {
      "name": "kv-alloc",
      "start": "2026-10-25T09:31:11.070671948Z",
      "end": "2026-10-25T09:31:11.073080769Z",
      "seconds": 0.002408821,
      "state": "complete",
      "attrs": {
        "gib": "1.0",
        "tokens": "29,056"
      },
      "sources": [
        "engine-log"
      ]
    },
    {
      "name": "server-ready",
      "start": "2026-10-25T09:31:16.038564038Z",
      "end": "2026-10-25T09:31:16Z",
      "seconds": 0,
      "state": "complete",
      "sources": [
        "container-status",
        "engine-log"
      ]
    },
    {
      "name": "first-token",
      "state": "absent"
    }
  ],
  "gaps": [
    {
      "after": "engine-init",
      "before": "weight-fetch",
      "seconds": 1.474187323
    },
    {
      "after": "kv-alloc",
      "before": "server-ready",
      "seconds": 4.965483269
    }
  ],
  "totals": {
    "pending_to_ready_seconds": 456
  }
}
